title,display_url,description1,description2
"Shop For Cat Food","www.wag.com/Cat","All Your Favorite Pet Brands.","Free 2-Day Delivery. Buy Today"
"Cat Food Up to 50% Off","www.petfooddirect.com/Cat_Food","Free Shipping on Orders $49+.","Cat Food 50% Off for Black Friday!"
"Natural Cat Food Brands","www.onlynaturalpet.com/","Natural Food is Healthier for Cats.","Wide Selection of Cat Food Brands."
"Cat Food Comparison","www.purinaone.com/beyOnd","See How Purina ONE beyOnd Compares","To Your Cat Food. Learn More Here!"
"Natural Cat Food","redmoonpetfood.com/Custom-Cat-Food","Fresh Not Made Until You Order it.","Free Shipping & 2 Free Supplements!"
"Cat Food Comparison Tool","www.bluebuffalo.com/","Find Out What's Behind the Labels.","Take the True BLUE Test. Learn More"
"Nutritious Cat Diets","www.purina.com/CatNutritionFacts","What Do Cats Need To Thrive? Learn","About Balanced Diets For Your Cats."